{"annotationVersion":"0.1.0","declaredRoles":["support","economy"],"expectedHardAcceptance":true,"expectedProfile":"classic-three-path-quality","knownLimitations":[],"mechanicFamilies":["automatic-ability","bounded-summon","complete-resource-cycle","economy","support"],"qualityClass":"mature-reference","schemaVersion":"0.1","unitId":"mosslight-exchange"}
